{
  "version": "1.0",
  "id": "goal",
  "metadata": {
    "created_at": "2026-10-04T16:15:40.668021+00:00",
    "completed_at": "2026-10-04T16:22:31Z",
    "status": "finalized",
    "tools": [
      "web_search",
      "urllib.request live HTTP retrieval",
      "Go researchcurator CLI"
    ],
    "search_provenance": "Actual web_search returned two official documents; two live URL aliases and Cytoscape docs intentionally added as labeled test probes. No generated search responses."
  },
  "rejected_sources": [
    {
      "id": "s3",
      "reason": "Duplicate of s2: exact canonical URL"
    },
    {
      "id": "s4",
      "reason": "Duplicate of s2: exact canonical URL"
    },
    {
      "id": "s5",
      "reason": "Outside contract: graph library documentation; explicit negative screening probe"
    }
  ],
  "contract": {
    "question": "Agent Skills 的渐进式加载如何工作，如何评估 skill description 的触发质量？",
    "types": [
      "official specification",
      "official authoring guide"
    ],
    "excludes": [
      "营销宣传",
      "不相关图形库文档",
      "同一页面的重复 URL"
    ],
    "freshness": "本次在线抓取当前官方文档；未声明发布日期则明确未知，不将抓取日期当发布日期。",
    "preferences": [
      "原始官方文档",
      "可定位引文",
      "将格式约束和运行环境差异分开"
    ],
    "quantity": 2,
    "depth": "简要综合与出处审计；不评价真实学习效果",
    "questions": [
      {
        "id": "q-loading",
        "text": "渐进式加载的各层何时载入？"
      },
      {
        "id": "q-trigger",
        "text": "如何测试触发，并避免把选择探针当作实际宿主证据？"
      }
    ]
  },
  "sources": [
    {
      "id": "s1",
      "url": "https://agentskills.io/skill-creation/optimizing-descriptions",
      "title": "Optimizing skill descriptions",
      "type": "official documentation",
      "original": true,
      "retrieved_at": "2026-10-04T16:15:44.102009+00:00",
      "content": "The basic approach: run each query through your agent with the skill installed and observe whether the agent invokes it. Make sure the skill is registered and discoverable by your agent — how this works varies by client (e.g., a skills directory, a configuration file, or a CLI flag).\nMost agent clients provide some form of observability — execution logs, tool call histories, or verbose output — that lets you see which skills were consulted during a run. Check your client’s documentation for details. The skill triggered if the agent loaded your skill’s SKILL.md; it didn’t trigger if the agent proceeded without consulting it.\nA query “passes” if:\nshould_trigger is true and the skill was invoked, or\nshould_trigger is false and the skill was not invoked.\n​\nThe most valuable negative test cases are near-misses — queries that share keywords or concepts with your skill but actually need something different. These test whether the description is precise, not just broad.",
      "content_hash": "7ab5f44f27b41086d1ccd05cfe215ea2e6e03f73a06b94c9b3800701045ce209",
      "upstream_ids": [],
      "freshness": "Retrieved live; publication date unavailable",
      "fit": 1,
      "evidence": 1,
      "utility": 1,
      "fit_reason": "Directly answers a contract question",
      "evidence_reason": "Official primary document retrieved HTTP 200; retained text excerpt inspected. Publication date unknown.",
      "utility_reason": "Useful original methodology or specification",
      "status": "selected",
      "reason": "Primary official passage directly answers the contract question",
      "verification": "verified"
    },
    {
      "id": "s2",
      "url": "https://agentskills.io/specification",
      "title": "Agent Skills specification",
      "type": "official documentation",
      "original": true,
      "retrieved_at": "2026-10-04T16:15:45.701712+00:00",
      "content": "Metadata (~100 tokens): The name and description fields are loaded at startup for all skills\nInstructions (< 5000 tokens recommended): The full SKILL.md body is loaded when the skill is activated\nResources (as needed): Files (e.g. those in scripts/, references/, or assets/) are loaded only when required",
      "content_hash": "cb10e6e226f312a81d3b9b4c69219a0652b3a57ca22bb8dfe565b4d540515fa2",
      "upstream_ids": [],
      "freshness": "Retrieved live; publication date unavailable",
      "fit": 1,
      "evidence": 1,
      "utility": 1,
      "fit_reason": "Directly answers a contract question",
      "evidence_reason": "Official primary document retrieved HTTP 200; retained text excerpt inspected. Publication date unknown.",
      "utility_reason": "Useful original methodology or specification",
      "status": "selected",
      "reason": "Primary official passage directly answers the contract question",
      "verification": "verified"
    },
    {
      "id": "s3",
      "url": "https://agentskills.io/specification?utm_source=curator-example",
      "title": "Specification — tracking URL probe",
      "type": "official documentation",
      "original": true,
      "retrieved_at": "2026-10-04T16:15:46.974425+00:00",
      "content": "Metadata (~100 tokens): The name and description fields are loaded at startup for all skills\nInstructions (< 5000 tokens recommended): The full SKILL.md body is loaded when the skill is activated\nResources (as needed): Files (e.g. those in scripts/, references/, or assets/) are loaded only when required",
      "content_hash": "cb10e6e226f312a81d3b9b4c69219a0652b3a57ca22bb8dfe565b4d540515fa2",
      "upstream_ids": [],
      "freshness": "Retrieved live; publication date unavailable",
      "fit": 1,
      "evidence": 1,
      "utility": 0.1,
      "fit_reason": "Directly answers a contract question",
      "evidence_reason": "Official primary document retrieved HTTP 200; retained text excerpt inspected. Publication date unknown.",
      "utility_reason": "No additional information; duplicate probe",
      "status": "duplicate",
      "reason": "Duplicate of s2: exact canonical URL",
      "duplicate_of": "s2",
      "verification": "verified"
    },
    {
      "id": "s4",
      "url": "https://agentskills.io/specification#progressive-disclosure",
      "title": "Specification — fragment URL probe",
      "type": "official documentation",
      "original": true,
      "retrieved_at": "2026-10-04T16:15:48.173271+00:00",
      "content": "Metadata (~100 tokens): The name and description fields are loaded at startup for all skills\nInstructions (< 5000 tokens recommended): The full SKILL.md body is loaded when the skill is activated\nResources (as needed): Files (e.g. those in scripts/, references/, or assets/) are loaded only when required",
      "content_hash": "cb10e6e226f312a81d3b9b4c69219a0652b3a57ca22bb8dfe565b4d540515fa2",
      "upstream_ids": [],
      "freshness": "Retrieved live; publication date unavailable",
      "fit": 1,
      "evidence": 1,
      "utility": 0.1,
      "fit_reason": "Directly answers a contract question",
      "evidence_reason": "Official primary document retrieved HTTP 200; retained text excerpt inspected. Publication date unknown.",
      "utility_reason": "No additional information; duplicate probe",
      "status": "duplicate",
      "reason": "Duplicate of s2: exact canonical URL",
      "duplicate_of": "s2",
      "verification": "verified"
    },
    {
      "id": "s5",
      "url": "https://js.cytoscape.org/",
      "title": "Cytoscape.js documentation — exclusion probe",
      "type": "official documentation",
      "original": true,
      "retrieved_at": "2026-10-04T16:15:49.980167+00:00",
      "content": "Cytoscape.js",
      "content_hash": "836195bd9dc18198f6294e0dcda8da7a0bab996d4104b7ba772d1b38bb0bfc91",
      "upstream_ids": [],
      "freshness": "Retrieved live; publication date unavailable",
      "fit": 0,
      "evidence": 1,
      "utility": 0,
      "fit_reason": "Outside contract: graph-library docs",
      "evidence_reason": "Official primary document retrieved HTTP 200; retained text excerpt inspected. Publication date unknown.",
      "utility_reason": "Not useful for the requested research question",
      "status": "rejected",
      "reason": "Outside contract: graph library documentation; explicit negative screening probe",
      "verification": "verified"
    }
  ],
  "claims": [
    {
      "id": "c-loading",
      "text": "Skill 加载分为元信息、按触发加载正文、按需加载资源三层。",
      "question_ids": [
        "q-loading"
      ],
      "evidence": [
        {
          "source_id": "s2",
          "quote": "Metadata (~100 tokens): The name and description fields are loaded at startup for all skills\nInstructions (< 5000 tokens recommended): The full SKILL.md body is loaded when the skill is activated\nResources (as needed): Files (e.g. those in scripts/, references/, or assets/) are loaded only when required",
          "locator": "https://agentskills.io/specification#progressive-disclosure",
          "relation": "supports",
          "verification": "verified"
        }
      ]
    },
    {
      "id": "c-trigger",
      "text": "触发评估应在实际宿主运行查询并检查 SKILL.md 是否被载入，不能只凭模型自报选择。",
      "question_ids": [
        "q-trigger"
      ],
      "evidence": [
        {
          "source_id": "s1",
          "quote": "The basic approach: run each query through your agent with the skill installed and observe whether the agent invokes it. Make sure the skill is registered and discoverable by your agent — how this works varies by client (e.g., a skills directory, a configuration file, or a CLI flag).\nMost agent clients provide some form of observability — execution logs, tool call histories, or verbose output — that lets you see which skills were consulted during a run. Check your client’s documentation for details. The skill triggered if the agent loaded your skill’s SKILL.md; it didn’t trigger if the agent proceeded without consulting it.\nA query “passes” if:\nshould_trigger is true and the skill was invoked, or\nshould_trigger is false and the skill was not invoked.\n​",
          "locator": "Testing whether a description triggers",
          "relation": "supports",
          "verification": "verified"
        }
      ]
    },
    {